{
  "meta": {
    "spec_id": "vfx_req_abandoned_temple",
    "level_id": "abandoned_temple",
    "version": "0.1.0",
    "owner": "level"
  },
  "context": {
    "intent": "废弃山寺特效需求——以环境氛围特效为主（落叶/山雾/蜡烛飘火），符文系列特效作为叙事节点的视觉锚点，钟楼铃铛触发的冲击波特效是 Part 2 最关键的反馈信号。",
    "level_type": "poi"
  },
  "overall": "整体特效方向：「自然衰败 + 超自然痕迹」双线并行。日常环境特效使用稀疏、随机、低饱和度的粒子（落叶/灰尘/水滴），避免廉价恐怖感；符文/石碑相关特效使用冷蓝白光系，与环境暖色调形成明确对比，是异质感的视觉来源。整体特效密度中低，以「少即精」为原则。",
  "effects": [
    {
      "name": "山雾流动",
      "category": "environmental",
      "description": "低矮地面雾气（高度 0-80cm），从山门方向缓慢流入庭院区域。密度随游戏时间推进缓慢增加（Part 1 稀薄 → Part 2 对峙时较浓）。粒子：体积光散射体积雾，非粒子系统，需要自定义 Shader 实现流动感。",
      "zone_id": "山门",
      "trigger": "常驻，Part 1 开始后密度每 5 分钟增加 10%",
      "status": "pending"
    },
    {
      "name": "枯叶飘落",
      "category": "environmental",
      "description": "秋末干枯叶片从廊顶/屋檐缓慢飘落，单帧最多 5-8 片。颜色：枯黄/棕红混合，尺寸随机（3-8cm）。飘落路径有随机水平偏移模拟穿堂风影响。落地时轻微物理碰撞停下（不弹跳）。",
      "zone_id": "回廊",
      "trigger": "常驻",
      "status": "pending"
    },
    {
      "name": "蜡烛火焰与烟雾",
      "category": "environmental",
      "description": "前殿多枚蜡烛的火焰系统：正常状态小幅摆动（模拟微风），守护者灯笼经过 2m 范围内时火焰受气流影响短暂剧烈抖动甚至熄灭 1-2 秒后复燃。烟雾丝状上升，与周围环境光交互产生体积感。颜色：火焰暖橙 #F5A623，烟雾冷灰半透。",
      "zone_id": "前殿",
      "trigger": "常驻；守护者经过触发扰动",
      "status": "pending"
    },
    {
      "name": "石碑符文冷光脉冲",
      "category": "narrative",
      "description": "地下密室石碑持续低频冷蓝光脉冲（基础频率 0.5Hz）。玩家进入 3m 触发范围后频率升至 1.5Hz；玩家接触石碑拓本时爆发一次高强度脉冲（0.3s 冷白闪光扩散至整个密室）。冷光颜色：#A0C8FF，扩散效果类似水面涟漪展开。",
      "zone_id": "地下密室",
      "trigger": "常驻（基础脉冲）+ 玩家接近/接触触发（增强脉冲）",
      "status": "pending"
    },
    {
      "name": "钟楼铃铛共鸣冲击波",
      "category": "interactive_object",
      "description": "玩家敲响铜钟时：① 铜钟表面金属高光闪烁（0.5s）；② 以铜钟为中心向外扩散同心圆冲击波（冷蓝色波纹，半径从 0 扩展至 15m，1.2s 完成）；③ 冲击波穿过守护者时在其身体轮廓处产生短暂蓝色边缘光（弱点暴露视觉信号）。需配合音频做听触觉一体化反馈。",
      "zone_id": "钟楼",
      "trigger": "玩家交互（敲钟）",
      "status": "pending"
    },
    {
      "name": "守护者弱点边缘光",
      "category": "narrative",
      "description": "铃铛冲击波触发后，守护者暴露弱点的 8 秒窗口内，其身体轮廓有持续蓝色边缘光（类 Rim Light 效果）。随弱点窗口结束时间临近，边缘光亮度逐渐衰减（最后 2 秒闪烁提示即将恢复）。颜色：#6AADFF。",
      "zone_id": "主殿",
      "trigger": "铃铛敲响后自动触发，持续 8 秒后消失",
      "status": "pending"
    },
    {
      "name": "机关激活白光闪烁",
      "category": "interactive_object",
      "description": "玩家激活主殿祭坛三处钥匙机关时，每激活一处触发一次冷白闪光（局部，半径 1m，持续 0.2s）。三处全部激活后地下密室入口处地面出现符文光印（蓝白色线条展开，0.8s 动画），同时石碑脉冲频率跳升至 2Hz。",
      "zone_id": "主殿",
      "trigger": "玩家激活钥匙机关",
      "status": "pending"
    },
    {
      "name": "灰尘微粒浮动",
      "category": "ambient",
      "description": "藏经阁书架区域漂浮细尘粒子，玩家或守护者经过时扰动增强（翻起更多尘粒）。粒子极小（1-2px），缓慢上下漂浮，在手电光束中特别明显。密度中低，避免遮蔽线索物件的视觉清晰度。",
      "zone_id": "藏经阁",
      "trigger": "常驻，人员经过触发扰动",
      "status": "pending"
    }
  ]
}
